{
  "environment": {
    "compiler": {
      "command": "c++",
      "id": "gcc",
      "version": "c++ (Ubuntu 11.4.0-1ubuntu1~22.04.3) 11.4.0"
    },
    "os": {
      "machine": "x86_64",
      "release": "6.8.0-83-generic",
      "system": "Linux"
    },
    "python": {
      "implementation": "CPython",
      "version": "3.13.2"
    },
    "python_dependencies": [
      {
        "distribution": "avengine",
        "version": "0.1.0a1"
      },
      {
        "distribution": "jsonschema",
        "version": "4.26.0"
      },
      {
        "distribution": "numpy",
        "version": "2.5.1"
      },
      {
        "distribution": "Pillow",
        "version": "12.3.0"
      }
    ]
  },
  "evidence_bundles": [
    {
      "artifacts": [
        {
          "byte_size": 320056,
          "path": "tmp/m6/formal_controlled_v1/audio/dry_buses/beagle_0_muzzle.wav",
          "root_id": "avengine",
          "sha256": "1ef81876e2fb2e6f40b600bce61cb8439ee44995bd0231bba201585698ec6601"
        },
        {
          "byte_size": 1127,
          "path": "tmp/m6/formal_controlled_v1/audio/dry_buses/beagle_0_muzzle.wav.json",
          "root_id": "avengine",
          "sha256": "4b075be18b44e5982e8c1b108ad5c0f6cceabe3490a3c5114b318b7b5bf85252"
        },
        {
          "byte_size": 320056,
          "path": "tmp/m6/formal_controlled_v1/audio/dry_buses/beagle_1_muzzle.wav",
          "root_id": "avengine",
          "sha256": "111fd0bac66c85fc74887552ed8339eacac5a0a47e76c372fdfac7c8eb0d218b"
        },
        {
          "byte_size": 920,
          "path": "tmp/m6/formal_controlled_v1/audio/dry_buses/beagle_1_muzzle.wav.json",
          "root_id": "avengine",
          "sha256": "496db5fa503a44d24a6f7ea14c514d799c1292927f6ab54de6afcd112ef241c2"
        },
        {
          "byte_size": 640056,
          "path": "tmp/m6/formal_controlled_v1/audio/mixture.wav",
          "root_id": "avengine",
          "sha256": "095cddf25c66a2819c41f35c7d1490ce8fa3dc3f1565f31d0bbbba873566abb6"
        },
        {
          "byte_size": 1594,
          "path": "tmp/m6/formal_controlled_v1/audio/mixture.wav.json",
          "root_id": "avengine",
          "sha256": "37372eca967f6fdbe9e42775bc0c6370ce2f9257773982ab6b369b37ac2918a2"
        },
        {
          "byte_size": 1280056,
          "path": "tmp/m6/formal_controlled_v1/audio/mixture_foa.wav",
          "root_id": "avengine",
          "sha256": "117bb504d9b99327d838ffdfda811dc0a7fb7d6cef085fb936a9ba085237af63"
        },
        {
          "byte_size": 1822,
          "path": "tmp/m6/formal_controlled_v1/audio/mixture_foa.wav.json",
          "root_id": "avengine",
          "sha256": "d6efef81b8e5982d7a3de5c1fa163dc662f8ec46d5c64346993292b58ca5db1b"
        },
        {
          "byte_size": 728,
          "path": "tmp/m6/formal_controlled_v1/audio/rir_or_rir_references/binaural/lengths.npy",
          "root_id": "avengine",
          "sha256": "7a2a070e3c90cd358c301d97b3a6a8a0bdcb6bda5ec33a1146a52642fffc1401"
        },
        {
          "byte_size": 113541,
          "path": "tmp/m6/formal_controlled_v1/audio/rir_or_rir_references/binaural/metadata.json",
          "root_id": "avengine",
          "sha256": "773b3ca19eeecb8a969eeff6c06dbff8fae1c4d30c29c69ac7509c7cde2a0f41"
        },
        {
          "byte_size": 20036528,
          "path": "tmp/m6/formal_controlled_v1/audio/rir_or_rir_references/binaural/samples.npy",
          "root_id": "avengine",
          "sha256": "a74021d36f21fb6dbde6d28449528f33412a5d878b8d2a6893412650ecec19b7"
        },
        {
          "byte_size": 728,
          "path": "tmp/m6/formal_controlled_v1/audio/rir_or_rir_references/foa/lengths.npy",
          "root_id": "avengine",
          "sha256": "7a2a070e3c90cd358c301d97b3a6a8a0bdcb6bda5ec33a1146a52642fffc1401"
        },
        {
          "byte_size": 112891,
          "path": "tmp/m6/formal_controlled_v1/audio/rir_or_rir_references/foa/metadata.json",
          "root_id": "avengine",
          "sha256": "733dcf80edb74d29295ee6b3bf23eb5e032ba6f82f6b735118cedbc6937629e9"
        },
        {
          "byte_size": 40072928,
          "path": "tmp/m6/formal_controlled_v1/audio/rir_or_rir_references/foa/samples.npy",
          "root_id": "avengine",
          "sha256": "079b6cbc3237b4876aca21f2fb55443a6c59b64214f5e170200fa3879517ec63"
        },
        {
          "byte_size": 640056,
          "path": "tmp/m6/formal_controlled_v1/audio/source_stems/binaural/beagle_0_muzzle.wav",
          "root_id": "avengine",
          "sha256": "095cddf25c66a2819c41f35c7d1490ce8fa3dc3f1565f31d0bbbba873566abb6"
        },
        {
          "byte_size": 1684,
          "path": "tmp/m6/formal_controlled_v1/audio/source_stems/binaural/beagle_0_muzzle.wav.json",
          "root_id": "avengine",
          "sha256": "41f7d1356e902c529c343834820ae7684c986c46711ee76bd9eeddd81b13f262"
        },
        {
          "byte_size": 640056,
          "path": "tmp/m6/formal_controlled_v1/audio/source_stems/binaural/beagle_1_muzzle.wav",
          "root_id": "avengine",
          "sha256": "485cadb404d559fc6eed9d97fdbaca580711e8d4c4e2ee0d28daa92acc5fca36"
        },
        {
          "byte_size": 1467,
          "path": "tmp/m6/formal_controlled_v1/audio/source_stems/binaural/beagle_1_muzzle.wav.json",
          "root_id": "avengine",
          "sha256": "fb299b6dbd4227535a62eca3588d2d70ff27910016f8ddac1679735a11fcea8d"
        },
        {
          "byte_size": 1280056,
          "path": "tmp/m6/formal_controlled_v1/audio/source_stems/foa/beagle_0_muzzle.wav",
          "root_id": "avengine",
          "sha256": "117bb504d9b99327d838ffdfda811dc0a7fb7d6cef085fb936a9ba085237af63"
        },
        {
          "byte_size": 1904,
          "path": "tmp/m6/formal_controlled_v1/audio/source_stems/foa/beagle_0_muzzle.wav.json",
          "root_id": "avengine",
          "sha256": "fe2200c31b02e6f9b4cff741992d9c452ffb92b9b20f59981da470a56a400010"
        },
        {
          "byte_size": 1280056,
          "path": "tmp/m6/formal_controlled_v1/audio/source_stems/foa/beagle_1_muzzle.wav",
          "root_id": "avengine",
          "sha256": "1eb14048cb5cd80f6712c52c48fbcc458133f4be9761ca8d0dac94f11135cade"
        },
        {
          "byte_size": 1691,
          "path": "tmp/m6/formal_controlled_v1/audio/source_stems/foa/beagle_1_muzzle.wav.json",
          "root_id": "avengine",
          "sha256": "93c5e4403718126e21b068506f1d8c9195d7c888b80888cd79658f2c030275d4"
        },
        {
          "byte_size": 19352,
          "path": "tmp/m6/formal_controlled_v1/entity_instances.json",
          "root_id": "avengine",
          "sha256": "d3d0e678c0d53e4cb95b232b6e080be6eb4aa81d97df0283eaf332f4ba876f6b"
        },
        {
          "byte_size": 28364,
          "path": "tmp/m6/formal_controlled_v1/evidence.json",
          "root_id": "avengine",
          "sha256": "3b68b34bbc59bd958ad12380bbdeddcfa71312ef5c4378dcddd2e040d2cb176a"
        },
        {
          "byte_size": 952,
          "path": "tmp/m6/formal_controlled_v1/final_status.json",
          "root_id": "avengine",
          "sha256": "d79c480697d735d4be04550f9d4dcd6e127ad26becd70e8338e7b4f8b74d5d4b"
        },
        {
          "byte_size": 26231,
          "path": "tmp/m6/formal_controlled_v1/flags/source_event_flag_report.json",
          "root_id": "avengine",
          "sha256": "08c889fb5fcbb8587ac325992526f44c625c525c22bc0d453cfdcc98776dfa97"
        },
        {
          "byte_size": 3382,
          "path": "tmp/m6/formal_controlled_v1/provenance/provenance_manifest.json",
          "root_id": "avengine",
          "sha256": "079c94c5cbf797e295c45e07957e83f6a84d554b6dcc7a56135d46fe61efb2dc"
        },
        {
          "byte_size": 4562,
          "path": "tmp/m6/formal_controlled_v1/provenance/registries/animal_templates_v1.json",
          "root_id": "avengine",
          "sha256": "973e20eda0a7de929ef64d0264e7127ca755b307e7fed6fcf6536d7e2cbd3c89"
        },
        {
          "byte_size": 2675,
          "path": "tmp/m6/formal_controlled_v1/provenance/registries/entity_assets_v1.json",
          "root_id": "avengine",
          "sha256": "63e9b86659f370dffbfa2b20769235bbc55f2cf9bc4b513c9ee0db9f77f9a779"
        },
        {
          "byte_size": 5490,
          "path": "tmp/m6/formal_controlled_v1/provenance/registries/legacy_m5_1_flags_v1.json",
          "root_id": "avengine",
          "sha256": "0cfe0ce5318a4f0d20473838230289a5dda08006c5a9cf3af9b2eb3001f3e826"
        },
        {
          "byte_size": 1268,
          "path": "tmp/m6/formal_controlled_v1/provenance/registries/sound_assets_v1.json",
          "root_id": "avengine",
          "sha256": "ffe3665bdf42ba5430db4a7c8e6ffeaecffd6116b0f7a68d800450c4b3feae3d"
        },
        {
          "byte_size": 1643,
          "path": "tmp/m6/formal_controlled_v1/provenance/registries/source_endpoints_v1.json",
          "root_id": "avengine",
          "sha256": "a1c77df9edc3f41e0a12ec767b2c6fc4aebfd6205836cf518601087947720d45"
        },
        {
          "byte_size": 42017,
          "path": "tmp/m6/formal_controlled_v1/provenance/upstream_emitter_path.json",
          "root_id": "avengine",
          "sha256": "d95094189f721f3f89fdd9862101ac75d83efeba870e213e73347eec3d58b76e"
        },
        {
          "byte_size": 147001,
          "path": "tmp/m6/formal_controlled_v1/provenance/upstream_m5_evidence.json",
          "root_id": "avengine",
          "sha256": "fd3efefd8ceb0c97bf1afbebb327ad023a9354a92dd3dd0929aacfef9c2a1ec7"
        },
        {
          "byte_size": 5225,
          "path": "tmp/m6/formal_controlled_v1/provenance/upstream_m5_request.json",
          "root_id": "avengine",
          "sha256": "76c5106d9f85735a0f559f5689af57f8fa42298107ac7f432699754cf004cfdc"
        },
        {
          "byte_size": 167888,
          "path": "tmp/m6/formal_controlled_v1/provenance/upstream_m5_timeline.json",
          "root_id": "avengine",